{"build_policy":{"edge_vocabulary":"legacy_biokg_v2_subset_plus_frozen_claims_v1","model_calls":false,"network":false,"semantic_extraction":false},"dangling_endpoints":0,"input":{"claim_contributions":{"path":"artifacts/claims/contributions.jsonl","records":2234,"sha256":"ea162fd9898c3c48913a990c6f8214a79e0b52da50c50ab27cad551a37abe040"},"findings":{"path":"artifacts/ledgers/findings.jsonl","records":8718,"sha256":"b1f9dc74ceb3a95cf41b14977abbc82c2d110303eca701b90ab2ae5da251acef"},"nodes":{"records":70969,"sha256":"377db4a550f037fa4ad07eeadbffe3c4877b61923112b4947340bb8842b2d82b"}},"output":{"bytes":22779554,"path":"relationships.jsonl","records":115724,"sha256":"ae4d579be6295251e35d88981652d4a69b1e3e0e817972bf691f8ec3500767d0"},"relationship_counts":{"CITES":18229,"EXPRESSES_CLAIM":2234,"HAS_FINDING":8718,"HAS_TARGET":8718,"REPORTS_GENE":28954,"SUPPORTED_BY":48871},"role_counts":{"ANCHORS":1015,"CONTRASTS":81,"QUALIFIES":402,"SUPPORTS":736,"evidence":48871,"finding_reported_comparator":28954,"finding_target":8718,"reference":18229,"target_to_finding":8718},"schema_version":"distributed_agents-biokg-relationship-build-v2"}
